{
  "case_id": "EXAMPLE-NOT-A-RESULT",
  "system_id": "unassigned",
  "result_state": "unrun",
  "statement_transaction_id": null,
  "statement_date": null,
  "statement_posting_date": null,
  "statement_merchant": null,
  "statement_amount": null,
  "statement_currency": null,
  "matched_receipt_id": null,
  "receipt_date": null,
  "receipt_merchant": null,
  "receipt_amount": null,
  "match_status": "not_scored",
  "discrepancy_type": null,
  "requires_review": null,
  "confidence": null,
  "evidence": [],
  "explanation": "Schema example only; this is not a system result or ground-truth label.",
  "processing_time_seconds": null,
  "manual_corrections": [],
  "system_error": null
}
